{
  "schema_version": 1,
  "subject": "g9_m120_oit_benchmark_harness",
  "symbolic_gate_key": "g9.p1.m120.oit_benchmark_harness",
  "matrix_row": "M120",
  "milestone": "M120",
  "assertion_id": "g9.p1.m120.oit_benchmark_harness",
  "status": "pass",
  "wave": "G9.5",
  "numeric_step": 164,
  "source_ref": "RFC-0025 §4.K;spec/display_pipeline.md RXS-0371;G9_ACCEPTANCE_MAP §3 M120",
  "base_commit": "1d298017991278e32e54d459589e296242718115",
  "host_section_pass": true,
  "device_section_state": "not_applicable",
  "checks": {
    "host_module_tests_anchored": true,
    "conformance_corpus_anchored": true,
    "band_provenance_frozen": true,
    "harness_full_pass": true,
    "harness_checks_closed_set_green": true,
    "harness_red_arm_submode_detected": true,
    "not_triggered_field_verified": true
  },
  "commands": [
    {
      "seq": 1,
      "command": "cargo test -p rurix-render --lib oit::selection",
      "exit_code": 0
    },
    {
      "seq": 2,
      "command": "cargo test -p rurix-render --lib oit::scene",
      "exit_code": 0
    },
    {
      "seq": 3,
      "command": "cargo test -p rurix-render --lib oit::measure",
      "exit_code": 0
    },
    {
      "seq": 4,
      "command": "cargo test -p rurix-render --lib oit::algorithms",
      "exit_code": 0
    },
    {
      "seq": 5,
      "command": "cargo build -p rurix-render --bin g9_m120_oit_benchmark",
      "exit_code": 0
    },
    {
      "seq": 6,
      "command": "H:\\rurix\\target\\debug\\g9_m120_oit_benchmark.exe --evidence H:\\rurix\\.tmp\\g95_gates\\m120\\harness_evidence.json",
      "exit_code": 0
    },
    {
      "seq": 7,
      "command": "H:\\rurix\\target\\debug\\g9_m120_oit_benchmark.exe --red-arm selection-without-data",
      "exit_code": 0
    },
    {
      "seq": 8,
      "command": "H:\\rurix\\target\\debug\\g9_m120_oit_benchmark.exe --red-arm unbounded-memory",
      "exit_code": 0
    }
  ],
  "evidence_level": "measured_local",
  "run_url": "",
  "timestamp": "20260815T030517Z",
  "environment": {
    "os": "Windows-11-10.0.28120-SP0",
    "python_version": "3.12.1",
    "cargo_version": "cargo 1.93.1 (083ac5135 2025-12-15)",
    "rustc_version": "rustc 1.93.1 (01f6ddf75 2026-02-11)"
  },
  "notes": "harness:七算法 × 4 档 evidence 非空 + 仅测量不定档 + 精确档 diff=0 + RED 双臂子模式复跑"
}
